Category,Query
Science & Environment,Latest climate change data 2023
Science & Environment,Microplastic pollution in oceans statistics
Science & Environment,Global deforestation rates 2023
Science & Environment,Ocean acidification effects on marine life
Science & Environment,Global warming effects on polar ice caps
Science & Environment,Water scarcity issues in developing countries
Science & Environment,Air quality changes in major cities
Science & Environment,Coral reef bleaching events data
Science & Environment,Sustainable agriculture practices adoption
Science & Environment,Green building materials market analysis
Science & Environment,Wildlife conservation success stories
Science & Environment,Mass extinction events historical data
Science & Environment,Ozone layer recovery data
Science & Environment,Ocean energy technologies potential
Science & Environment,Global fish stocks depletion rates
Science & Environment,Sustainable tourism practices benefits
Science & Environment,Carbon capture and storage projects
Science & Environment,Environmental impact of fast fashion
Science & Environment,Urban green spaces benefits
Science & Environment,Noise pollution effects on health
Technology & Innovation,Artificial intelligence trends in healthcare
Technology & Innovation,Internet of Things (IoT) growth projections
Technology & Innovation,Quantum computing breakthroughs
Technology & Innovation,Autonomous vehicles safety data
Technology & Innovation,Blockchain technology in finance data
Technology & Innovation,Augmented reality in education case studies
Technology & Innovation,Electric vehicle market share increase
Technology & Innovation,Nanotechnology applications in medicine
Technology & Innovation,Deep learning applications in image recognition
Technology & Innovation,Smart cities technology implementation
Technology & Innovation,Drone technology in agriculture efficiency
Technology & Innovation,AI in predictive maintenance case studies
Technology & Innovation,3D printing in construction industry
Technology & Innovation,eSports market growth analysis
Technology & Innovation,Quantum cryptography security advantages
Technology & Innovation,Renewable energy patents filings trends
Technology & Innovation,Machine learning in financial fraud detection
Health & Wellness,COVID-19 pandemic impact on global economy
Health & Wellness,Mental health statistics by age group
Health & Wellness,Vaccine development timelines comparison
Health & Wellness,Cybersecurity threats statistics
Health & Wellness,Plant-based diet health benefits
Health & Wellness,Telemedicine adoption rates by country
Health & Wellness,Antimicrobial resistance trends
Health & Wellness,Mental health apps effectiveness
Health & Wellness,Biodegradable plastics market trends
Health & Wellness,Wearable technology health benefits
Health & Wellness,Telehealth barriers in rural areas
Health & Wellness,Video game addiction research data
Social Sciences & Economics,Social media's impact on political polarization
Social Sciences & Economics,Gig economy workforce statistics
Social Sciences & Economics,Global literacy rates trends
Social Sciences & Economics,Gender pay gap statistics by industry
Social Sciences & Economics,Digital divide impact on education
Social Sciences & Economics,Online privacy concerns survey results
Social Sciences & Economics,Minimum wage effects on employment
Social Sciences & Economics,Income inequality effects on society
Social Sciences & Economics,Refugee crisis statistics by region
Social Sciences & Economics,Remote work productivity studies
Social Sciences & Economics,Youth unemployment rates by country
Social Sciences & Economics,Cultural heritage sites at risk
Social Sciences & Economics,Clean water access disparities
Social Sciences & Economics,Homelessness reduction strategies
Social Sciences & Economics,Child labor statistics in supply chains
Social Sciences & Economics,Global hunger reduction strategies
Social Sciences & Economics,Aging population economic effects
Social Sciences & Economics,Climate refugees statistics projections
Social Sciences & Economics,Impact investing market size
Education & Digital Society,E-commerce growth during COVID-19
Education & Digital Society,Digital currency adoption challenges
Education & Digital Society,Organic farming vs conventional farming yields
Education & Digital Society,Language extinction rates
Education & Digital Society,Cloud computing in small businesses
Education & Digital Society,Digital art copyright issues
Education & Digital Society,Food waste reduction technologies
Education & Digital Society,Digital literacy programs effectiveness
Education & Digital Society,Solar power cost per kWh trends
Education & Digital Society,Mobile banking adoption in Africa
Education & Digital Society,Peer-to-peer lending growth statistics
Education & Digital Society,Virtual reality in therapy research
Education & Digital Society,Virtual classrooms effectiveness during pandemic
Education & Digital Society,Volunteerism benefits on mental health
Education & Digital Society,Microfinance impact in developing countries
Education & Digital Society,Gigabit internet access global spread
Education & Digital Society,Sustainable fashion consumer trends
